{
 "register": "sadi.interpretive_questions",
 "status": "candidate",
 "provenance": "Surfaced while proving al-Saʿdī's readings to be instances of Usul.Schema. Each question names an interpretive commitment, the alternatives, the typed pins that fail if it changes, established answers cited from the pinned Ḥanbalī corpus (by record id or source locator), and analogies (internal ones licensed by a shared schema, illustrative ones non-evidential). LLM-drafted; awaiting human review (Review.tla).",
 "authority": {
  "gate": "SHARIAH-AUTHORITY",
  "class": "C",
  "basis": [
   "halaqa shared/STUB-CLASSIFICATION.md: usul-k/ is class C, reserved to Sharīʿah authority",
   "ICM-H §17: research agents may classify, compare, identify uncertainty and surface questions",
   "ICM-H §32: analytical preparation never satisfies a SHARIAH-AUTHORITY gate",
   "docs/architecture/deontic-circuits-harness.md: the LLM proposes; only human review admits"
  ],
  "this_register_may": [
   "name the commitment an encoding makes",
   "list alternatives found in the tradition",
   "cite an established answer from a pinned source, with its relation to the commitment",
   "offer analogies: internal ones licensed by a shared schema (qiyās), illustrative ones marked non-evidential",
   "say which formal pins change if the commitment changes",
   "suggest the usul-k home a ruling would eventually live in"
  ],
  "this_register_may_not": [
   "adopt an answer or rank the alternatives",
   "treat an analogy as outranking a cited text",
   "write to halaqa shared/usul-k/",
   "promote a reading past candidate"
  ]
 },
 "process": {
  "note": "The review applies the project's principles to itself where this cannot deadlock (Usul.Process). Status is computed: referenced if an established answer is cited, else analogized if an internal analogy is offered, else open. Stratification is checked at the level of Lean constants: the process relies only on the undisputed core of each rule it uses (relies_on), and no live question may pin one of those constants.",
  "uses": [
   8,
   11,
   58
  ],
  "uses_why": {
   "8": "adoption is a gate (SHARIAH-AUTHORITY), never a status here",
   "11": "status persists until evidence on file changes it",
   "58": "internal analogies are qiyās through a shared schema; manʿ (a missing tag) rejects one"
  },
  "avoids": {
   "33": "IQ-10 is open on Q33's tie-break; choosing among cited answers by 'best' would wait on its own question"
  },
  "lean": [
   "Usul.Process.status",
   "Usul.Process.analogy_never_outranks_text",
   "Usul.Process.order_is_resort",
   "Usul.Process.never_adopts",
   "Usul.Process.Licensed",
   "Usul.Process.man",
   "Usul.Process.Stratified",
   "Usul.Process.no_deadlock_of_stratified",
   "Usul.Process.no_cycle_of_rank"
  ],
  "relies_on": {
   "8": [
    "Usul.Sadi.Gate.Holds",
    "Usul.Process.never_adopts"
   ],
   "11": [
    "Usul.Schema.yaqin_doubts_inert",
    "Usul.Process.status"
   ],
   "58": [
    "Usul.Schema.Factors.qiyas",
    "Usul.Process.Licensed",
    "Usul.Process.man",
    "Usul.Qiyas.man_defeats"
   ]
  }
 },
 "questions": [
  {
   "id": "IQ-01",
   "rules": [
    10
   ],
   "schemata": [
    "S6-presumption"
   ],
   "pins": [
    "Usul.Muamalat.q10_from_presumption"
   ],
   "commitment": "The operative presumption for a claim is barāʾat al-dhimma (no liability), so the denier is whoever agrees with it and the claimant whoever departs from it.",
   "alternatives": [
    "The apparent state (al-ẓāhir) as the presumption, which can place the claimant role on the party asserting freedom from liability.",
    "A presumption fixed per bāb rather than one for all claims."
   ],
   "if_changed": "Change the presumption argument of burdenOf in q10_from_presumption; the S6 pin for Q10 fails until the new presumption is stated.",
   "route": "halaqa:shared/usul-k/evidence-order.md",
   "status": "referenced",
   "established": [
    {
     "ref": "ibn_rajab.taqrir_qawaid.openiti_rajab_shamela21730.q159",
     "relation": "refines",
     "note": "When the presumption (aṣl) and the apparent state (ẓāhir) conflict: an apparent state that is a sharʿī proof (testimony, report) prevails without dispute; one resting on custom, habit, indications or preponderant belief sometimes yields, sometimes prevails, and sometimes the madhhab is divided. A single presumption covers one of these classes only."
    }
   ],
   "analogies": [
    {
     "kind": "internal",
     "asl": 52,
     "schema": "S6-presumption",
     "transported": "Usul.Schema.burden_after_update",
     "note": "As in Q52, an indication strong enough to displace the presumption moves the burden; IQ-01 asks which presumption is displaced."
    },
    {
     "kind": "illustrative",
     "domain": "civil law",
     "note": "actori incumbit probatio: the burden lies on whoever asserts a change from the status quo, which is S6 with the status quo as presumption."
    }
   ]
  },
  {
   "id": "IQ-02",
   "rules": [
    26,
    43
   ],
   "schemata": [
    "S6-presumption"
   ],
   "pins": [
    "Usul.Muamalat.returnPresumption",
    "Usul.Muamalat.q26_q43_from_presumption"
   ],
   "commitment": "When sense or custom belies a trustee, the presumption that he returned the thing is displaced entirely, and he must bring evidence.",
   "alternatives": [
    "Being belied only weakens the presumption: the oath is still accepted, but with a stronger form or added conditions.",
    "Only sense (ḥiss) displaces it; custom (ʿurf) does not."
   ],
   "if_changed": "returnPresumption would need a graded result (a Qawaid.Held with a Grade) instead of a Bool, and burden_after_update (Q52) would decide; the Q26/Q43 pins fail.",
   "route": "halaqa:shared/usul-k/evidence-order.md",
   "status": "referenced",
   "established": [
    {
     "ref": "ibn_rajab.taqrir_qawaid.openiti_rajab_shamela21730.q044",
     "relation": "refines",
     "note": "For loss, every trustee's word is accepted, since trust means no liability. For return, trustees fall into three classes; one who took the property for the owner's benefit alone is believed (the madhhab), but a narration through Abū Ṭālib and Ibn Manṣūr holds that a deposit proved by evidence is not discharged by a bare claim of return."
    },
    {
     "ref": "ibn_rajab.taqrir_qawaid.openiti_rajab_shamela21730.q159",
     "relation": "bears-on",
     "note": "Displacement by custom or indication is the second class of aṣl/ẓāhir conflict, where the madhhab goes both ways."
    }
   ],
   "analogies": [
    {
     "kind": "internal",
     "asl": 10,
     "schema": "S6-presumption",
     "transported": "Usul.Schema.burden_factors",
     "note": "As for claimant and denier, the trustee's role is derived from whether his claim agrees with the presumption."
    },
    {
     "kind": "illustrative",
     "domain": "common law of bailment",
     "note": "A bailee for the bailor's sole benefit is held to a lighter standard than one who benefits himself."
    }
   ]
  },
  {
   "id": "IQ-03",
   "rules": [
    55
   ],
   "schemata": [
    "S5-inert"
   ],
   "pins": [
    "Usul.Muamalat.plead",
    "Usul.Muamalat.q55_confession_absorbs"
   ],
   "commitment": "After a confession, every later plea (a claim of error, a retraction) is inert. This reading is for the rights of persons (ḥuqūq al-ādamiyyīn).",
   "alternatives": [
    "In the ḥudūd (rights of God) a retraction is accepted, so retract is not inert there and needs its own plead.",
    "A claim of error is inert but a retraction is not, in some domains."
   ],
   "if_changed": "A domain parameter on plead; q55_confession_absorbs then holds only for the persons domain, and a second S5 instance (without retract) is pinned for ḥudūd.",
   "route": "halaqa:shared/usul-k/derogation.md",
   "status": "referenced",
   "established": [
    {
     "ref": "src:openiti-insaf-shamela21609/v12:p008",
     "relation": "refines",
     "note": "The judge may invite one who confessed to a ḥadd to retract; al-Intiṣār: prompting the retraction is lawful. So in the ḥudūd a retraction is not inert.",
     "excerpt_ar": "للحاكم أن يعرض للمقر بحد أن يرجع عن إقراره، وقال في الانتصار: تلقينه الرجوع مشروع"
    },
    {
     "ref": "src:openiti-ilam-shamela11496/v03:p295",
     "relation": "refines",
     "note": "Retracting the confession drops the ḥadd (the case of Māʿiz: 'why did you not leave him to repent').",
     "excerpt_ar": "فالحيلة أن يرجع عن إقراره فيسقط عنه الحد"
    }
   ],
   "analogies": [
    {
     "kind": "internal",
     "asl": 11,
     "schema": "S5-inert",
     "transported": "Usul.Schema.yaqin_doubts_inert",
     "note": "As later doubts are inert on a certain judgement (Q11), later pleas are inert on a confession; both are absorbing states."
    },
    {
     "kind": "illustrative",
     "domain": "evidence law",
     "note": "An admission against interest binds in civil matters, while a criminal confession may be withdrawn before judgment: the same split as persons/ḥudūd."
    }
   ]
  },
  {
   "id": "IQ-04",
   "rules": [
    41
   ],
   "schemata": [
    "S7-merge"
   ],
   "pins": [
    "Usul.Kulliyyat.Merges",
    "Usul.Kulliyyat.q41_representatives"
   ],
   "commitment": "Two owed acts merge when kind and purpose are equal, whatever the occasion that made each owed. 'Purpose' is a label compared for equality.",
   "alternatives": [
    "Purpose as intention (niyya): merging needs the performer to intend both, or to intend the higher one.",
    "Merging limited to listed kinds (ṭahāra, ḥudūd of one genus) instead of every kind."
   ],
   "if_changed": "Merges gains an intention argument or a kind whitelist; it must stay reflexive for reps_covers, and the S7 pin records whether it is still an equivalence.",
   "route": "halaqa:shared/usul-k/operators.md",
   "status": "referenced",
   "established": [
    {
     "ref": "ibn_rajab.taqrir_qawaid.openiti_rajab_shamela21730.q018",
     "relation": "contradicts",